{"schema_version":"0.2","spec_id":"AWG-SPEC-DISCUSSION-BATCHING","version":1,"decision_class":"design","objective":"Batch independent discussion points while preserving per-point proposals, implications, partial responses, and evaluation of user-added solutions.","scope":["point identity","independence relation","ranked proposals","partial responses","added proposal evaluation","query batching"],"assumptions":["AWG decision authority remains per point","Coupled points are not silently batched","The session is offline and provider-neutral"],"unknowns":["Future renderers may use list or tree navigation"],"state_variables":["draft points","batched session","per-point responses","evaluated additions"],"transitions":["draft -> batched","batched -> partially-answered","partially-answered -> complete"],"invariants":["Each point has at least two proposals and an implication helper","Each point has independent response identity","A user-added proposal is evaluated before selection","Partial responses do not authorize unanswered points","Coupled points are excluded or explicitly related"],"acceptance_predicates":["A valid independent batch passes","Omitted proposals, cross-point authorization, unevaluated additions, and unbatched query traces fail"],"formalization":{"method":"state-machine","model_ref":"specifications/discussion-batching.json","checker":"tools/check_batched_discussion.py plus tools/check_spec.py","command":["python","tools/check_batched_discussion.py","examples/discussion-batch.json"],"scope":"finite batched discussion points","expected_result":"invariants-hold","timeout_seconds":60,"model":{"states":["draft","batched","partially-answered","complete"],"initial":"draft","transitions":[{"from":"draft","to":"batched"},{"from":"batched","to":"partially-answered"},{"from":"partially-answered","to":"complete"}],"forbidden_transitions":[{"from":"draft","to":"complete"},{"from":"batched","to":"complete"}]}}}
