{"schema_version":"0.2","spec_id":"AWG-SPEC-DISCUSSION-PERSISTENCE","version":1,"decision_class":"design","objective":"Persist discussion sessions losslessly across safe exit and resume while classifying every future-discussion request into a reviewable AR mapping.","scope":["append-only session journal","atomic revision binding","safe resume","re-ask status","future request mapping"],"assumptions":["Private raw text remains outside public state","Public records retain bounded summaries and digests","Coordinator owns AR identity and revision"],"unknowns":["Storage adapters may vary while preserving journal semantics"],"state_variables":["journal revision","point records","save marker","resume disposition","future request mapping"],"transitions":["active -> saving","saving -> saved","saving -> interrupted","interrupted -> resumed","saved -> re-ask"],"invariants":["A save is atomic and revision-bound","Duplicate saves do not erase prior records","Stale resumes fail closed","Re-ask and unresolved status remain visible","Every future request is classified and mapped or explicitly rejected"],"acceptance_predicates":["A complete journal passes","Interrupted, stale, duplicate, omitted-request, and unmapped-request fixtures reject"],"formalization":{"method":"state-machine","model_ref":"specifications/discussion-persistence.json","checker":"tools/check_discussion_persistence.py plus tools/check_spec.py","command":["python","tools/check_discussion_persistence.py","examples/discussion-persistence.json"],"scope":"finite session journal and future-request mapping","expected_result":"invariants-hold","timeout_seconds":60,"model":{"states":["active","saving","saved","interrupted","resumed","re-ask"],"initial":"active","transitions":[{"from":"active","to":"saving"},{"from":"saving","to":"saved"},{"from":"saving","to":"interrupted"},{"from":"interrupted","to":"resumed"},{"from":"saved","to":"re-ask"}],"forbidden_transitions":[{"from":"interrupted","to":"saved"},{"from":"active","to":"resumed"}]}}}
