{"schema_version":"0.2","spec_id":"AWG-SPEC-TUI-CROSS-PROJECT-INTEGRATION","version":1,"decision_class":"design","objective":"Bind agent- and user-initiated TUI sessions to Coordinator revisions, AWQ evidence, formal review, persistence, and reconciliation without bypasses.","scope":["entry point","event sequence","task revision","formal and quality evidence"],"assumptions":["Coordinator owns task identity","AWQ owns quality evidence","Runtime providers are out of scope"],"unknowns":["Future transports may add metadata"],"state_variables":["entry","events","revision","formal gate","quality gate","handoff"],"transitions":["entry -> packet","packet -> formal-review","formal-review -> user-response","user-response -> persistence","persistence -> coordinator-event","coordinator-event -> quality","quality -> reconciliation"],"invariants":["Both entry points use one contract","No handoff without formal and quality evidence","Every event binds to the task revision","Coordinator and AWQ ownership are not bypassed"],"acceptance_predicates":["Positive trace passes","Incomplete or bypass traces reject"],"formalization":{"method":"state-machine","model_ref":"specifications/tui-cross-project-integration.json","checker":"tools/check_tui_integration.py plus tools/check_spec.py","command":["python","tools/check_tui_integration.py","examples/tui-integration.json"],"scope":"finite cross-project TUI trace","expected_result":"invariants-hold","timeout_seconds":60,"model":{"states":["entry","packet","formal-review","user-response","persistence","coordinator-event","quality","reconciliation"],"initial":"entry","transitions":[{"from":"entry","to":"packet"},{"from":"packet","to":"formal-review"},{"from":"formal-review","to":"user-response"},{"from":"user-response","to":"persistence"},{"from":"persistence","to":"coordinator-event"},{"from":"coordinator-event","to":"quality"},{"from":"quality","to":"reconciliation"}],"forbidden_transitions":[{"from":"entry","to":"reconciliation"},{"from":"packet","to":"coordinator-event"}]}}}
